title,filename,hgv,languages,date_text,date_from,date_to,place,text,text_length
p.panop.8,p.panop.8,16154,"['en', 'grc']",7. Sept. 338,,,Panopolis,"ῳ Ἀπόλλωνι Ἀπόλλ ο νι Δ ί ο υ ἄρξαντι Πανὸς π όλ εως π αρὰ Αὐρηλίου Πασσνῶτος Πασσνῶτος Ἀλόπηκ ος ἀπὸ τ ῆς αὐτῆ ς . μεμίσθωμαι μεμίσθομαι παρὰ σ ο ῦ ἀπὸ σήμερ ο ν ἐπὶ χρόνο ν δ ιετ ῆ δ ιεδ η τὸ μέρος σου ἐλαιοφοινικῶν ο ς ἐλεοφοινικῶν ο ς περὶ πόλιν πόλειν ἐκ βορ ρ ᾶ παρεμβολῆς παρα ιμ μβουλῆς ποτίζων ἀπὸ τοῦ ἐπιβάλλον τος επιβαλον τος σοι κ αὶ κ ληρ ο ν όμοις Ῥοδίνης Ῥωδίνης Ἀπόλλωνοᾳ μέρους ἡμίσους λάκκο υ το ῦ ἐνόντος καὶ τελέσω σοι ὑ π ὲ ρ φόρου τὸ ἥμισυ φοινίκ ων κ αὶ ἐλ αιῶν καὶ ποτίσω ἀλλότρ ια ἐδάφη χωρὶς φ όρου ὑδρείας ὑδρίας ἀπὸ τοῦ αὐτ οῦ ἐπιβάλ λ οντος ἐπιβάλοντος ὑμῖν μέρους ἡμ ί σους λάκκου καὶ πα ρέ ξω ος ἀ πὸ τοῦ αὐ τοῦ μ έ ρο υς σου ἐ λαι οφοι νικῶνος ὑπὲρ λόγου ἐξαιρέτου καινὰ καὶ πυθμ ένα ἕνα ἐλαίας, τῶν δημο σίω ν πάντων ὄντω ν πρὸς σὲ τ ὸ ν γεοῦχον, καὶ ἐπε ρ ω τ ηθεὶς ὡ μολό γησα . ὑπατείας Οὔ ρσου κ α ὶ Πολεμίου τῶν λα μ πρ ο τ ά των Θὼθ α ἐγρά φη δ ιʼ ἐμοῦ Ἀρτεμιδώρ ου ὁ πρ οκ είμενος ἐξ ε μ ί σ θωσα ἐ πὶ τ ο ῖ ς προκ ειμένοις δέματα ἕξ , τοῦ ὀργανικοῦ ος ὄντος πρὸς σ ὲ τὸν μισθωτή ν .",1024
p.panop.11,p.panop.11,16157,"['en', 'grc']",27. Nov. 320,,,Panopolis,"Αὐρηλίᾳ Θε ο δωρᾳ ἐλ α ιοπωλίσσῃ ἐ λ α ιωπωλίσσᾳ ἀπ ὸ Πανὸς π ό λ εως π αρ ὰ Σοφίας Ὡρίωνος ἀπὸ τῆς αὐτῆς . μ ε μίσ θ ωμαι π αρὰ σοῦ ἀπὸ τοῦ ὄντος μ η νὸς Χοιὰ κ π ρὸς χρόνον διετῆ τὴν τ ρ ί τ ην στ έ γην ἀπὸ οἰκίας σου οὔσης ἐ πὶ τοῦ β ἀμφ ό δ ου πό λ εως καὶ τελέσω σοι κατʼ ἔτος ὑ π ὲρ ἐ ν ο ικίου ἀργ υ ρίου δραχμὰς τρισχιλί ας τρεισχειλί ας , γίνονται ἀργ υρίου δραχμαὶ Γ , μεθʼ ὃ ν προκείμενον χρόνον ἀπ οδώσω σοι ὡς παρείληφα, καὶ ἐπερω τηθεῖσα ὡμολόγησα. ὑ π ατ είας τῶν δεσποτῶν ἡμῶν Κωνστ αντίνου Σεβαστοῦ τὸ ϛ καὶ Κωνσταντίνου τοῦ ἐπι φανεστάτου Καίσαρος τὸ α Χοιὰκ α .",580
p.panop.19colviiid,p.panop.19colviiid,16164u,"['en', 'grc']",,,,,ὀνό ματος Πασνῶτος Ἀλώπηκος ὑπὲρ καταδίκης Κλεοπάτρου μερισθείσ ης μερισθεις εἰς χλαμύδ ας χρυσοῦ γρ άμμα α η μόνον. μετὰ τὴν ὑπατείαν τὸ β καὶ τὸ α Μεχεὶρ κ α . Κόλανθος ἐξ έδωκα τὴν ἀποχ ήν .,193
p.panop.19colid,p.panop.19colid,16164d,"['en', 'grc']",,,,,"ὀνό ματος υἱῶν Βησᾶ Ἀντωνίνου Ἀλώπεκος ὑπὲρ β νέας ἰνδ ικτίωνος χλαμύδος ἕκτον, γί νεται χλ αμύδος ϛ μόνον. ὑπατείας Πλακίδου καὶ Ῥωμύλου Φαῶφι η . Ἀρσίνους ἐξ έδωκα . Χαρίσιος ἐξ έδωκα ὡς π ρόκειται . Πανίσκος σεσημ είωμαι .",225
p.panop.19colxi,p.panop.19colxi,16164z,"['en', 'grc']",,,,,"ὀνό ματος υ ἱ ὸς β Βησᾶ Ἀντωνίνου Ἀλώπηκος ὑπὲρ α φυλῆς Τριαδέλφου χάρται ἓξ αδη τάλαντα τεσσεράκοντα, γί νονται χάρτ αι ϛ αδη τάλαντα μ μόνα μον α ς . μετὰ τὴν ὑπ ατείαν Μαρκελλίνου καὶ Προβίνου τῶν λαμπροτάτων Τῦβι ιζ . Ἀπόλλων Βησᾶ ἐξ έδωκα ὡς πρ όκειται .",259
p.panop.19coliiia,p.panop.19coliiia,16164g,"['en', 'grc']",,,,,"ὀνό ματος υἱῶν υἱο ι Ἀντωνίνου Βησᾶ Ἀλώπηκος ὑπὲρ ιδ ἰνδικτίωνος χρυσοῦ τελωνι κοῦ γράμμα τος ἥμισυ τρίτον τετρακαιει κοστὸν τεσσαρακοστόγδοον τεσσα ρακοσόγδοον , γί νεται χρυσοῦ γρά μματος 𐅵 γ κδ μη . ὑπατείας Ἀκινδύνου καὶ Προκούλου Μεσορὴ ἐπαγομένω ν τρίτῃ. Θαυμάσιος ἐξ έδωκα .",281
p.panop.31,p.panop.31,16201,"['en', 'grc', 'la']",ca. 329,,,Panopolis,"ἀδικεῖ τὸν αὐτ ὸν γεγηρακ ότα Ἱερακαπόλλων τις βουλ ευτὴς ἐπὶ ταύτ ης πόλε ως · γειτν ιεύων εειτν αὐτ ῷ κατʼ ἀγρο ὺς ἀπέσπασ εν ἀρ ούρας ε το ῦ β οη θ ουμένου ἐπὶ τοῦ παρ όντος ἐνιαυτ οῦ προόντ ι μην ὶ τῇ βί ᾳ χρ ώμ ενος · ἐπ εὶ πά ν τα αὐτ ὸς συντελεῖ ὑπ ὲρ τῆς γῆς δεῖται ἀποκαταστ αθῆναι αὐτῷ ἔτι δὲ τὲ κ αὶ τοὺς φόρ ους βοηθείᾳ Ἡσυχίου ἀπὸ ἐξ ακτόρων , εἰ ἠ ἀναισχ υντοίη πέμπ εσθαι εἰς τὸ δικ αστήριον",406
p.panop.2,p.panop.2,16148,"['en', 'grc']",22. Okt. 308,,,Panopolis,"Αὐρηλ ίῳ Ποιμενίῳ προεδρεύσαντι παρὰ Αὐρηλ ίου Πανσνῶτος Βησᾶ ἐλαιουργοῦ ἀπὸ Πανὸς πόλ εως . μεμίσθωμαι παρὰ σοῦ πρὸς μόνον τὸ ἐνεστὸς ἔτος χέρσ ον γῆν περὶ πεδ ίον Θμοήσεως ἐξ ἀπηλ ιώτου τοῦ λάκκου εἰς κατάθεσιν ὧν ἐὰν βούλωμαι βούλομαι γενῶν πρὸς ἀναμέτρη σιν φόρου ἑκάστης ἀρού ρη ς ἐπ ʼ ἀποτάκτου ἀργυρίου Σεβαστῶν νομίσματος δραχ μῶν πεντακοσίων πεντακοσίας , χωρὶς δια φόρου καὶ χειριστικοῦ τῶν δημοσ ίων πάντων καὶ ἐπι βολῶν ὄντων πρὸς σὲ τὸν γεοῦχον. ὑπατείας τῶν δεσποτῶν ἡμῶν Διοκλητιανοῦ πατρὸς Αὐγούσ τ ων Ἀγούσ τ ων τὸ ι καὶ Γαλερίου Ο ὐαλ ερίου Μαξιμιανοῦ Αὐγούσ το υ Ἀγούσ το υ τὸ ζ πρὸ ια Καλανδῶν Νωεμβρίων. Ποιμένιος διʼ ἐμοῦ Δημητρίου ἐξεμίσθωσα πρὸς Ἀνουβᾶν τὸν καὶ Χα βρίαν —.",697
p.panop.3,p.panop.3,16149,"['en', 'grc']",28. Okt. - 26. Nov. 310,0310-10-28,0310-11-26,Panopolis,"Α ὐρηλ ίᾳ Ἀπολλωνίᾳ ἀπὸ Παν ὸ ς πό λ εως π αρὰ Αὐρ ηλ ίου Πασνῶτος Βησᾶ ἀπὸ τῆς αὐτῆς . μεμίσθωμαι παρὰ σοῦ ἀπὸ το ῦ ὄ ντος μηνὸς Ἁθὺρ τῆ ς ἐνεστώσ η ς ὑπατείας πρὸς διετῆ χρόνον τὸ αἱροῦν σοι μέρος τοῦ ἐλαιοφοι ν ικῶνός σου περὶ πεδίον πεδιου Π μού χεως ἐφʼ ᾧ με μαι ποτί σαι ἀ μέμπτ ω ς, καὶ παρέχω σ ο ι ὑπὲρ φόρου παν τὸς το ῦ περ ι γινομένο υ ἐλαιῶν τε καὶ φοινίκω ν ἐμο ὶ μὲν τῷ μι σθωτῇ μέρ ο ς ἓν ἥμισυ , σοὶ δὲ τῇ γεο ύ χῳ , φόρου τοῦ ξυλικοῦ ὀργ άνου κα ὶ ἀ γγ ἐκ κο ινοῦ αἰ ρο μέ ν ου, τῶ ν δημ οσίων πάντων ὄντων πρὸς σὲ τὴν γεοῦχ ον . ὑπατ είας Τατίου Ἀνδρονίκου καὶ Πομπηίου Πρό βο υ τῶν λαμπροτάτων ἐπάρχων τοῦ ἱεροῦ πρ αιτωρίου Ἁθύρ.",649
p.panop.19colxa,p.panop.19colxa,16164x,"['en', 'grc']",,,,,"ὀνό ματος υἱῶν υ ἱ οι Βη σ ᾶ Ἀντωνίνου Ἀλώπηκος ὑπὲρ γ ἰνδικ τίωνος χρυσοῦ τελωνικοῦ γράμματος ἥμισυ τρίτον τετρακαιεικοστόν, γί νεται γρ άμματος 𐅵 γ κδ μό νον . ὑπατείας Λεοντίου καὶ Σαλουστίου Θὼθ ραπο ρος ἐξ έδωκα .",218
p.panop.6,p.panop.6,16152,"['en', 'grc']",336,,,Panopolis,"ομ εἰς κατὰ θεσ ιν κρι θῆ ς φόρο υ ἀ ποτάκτου κ ριθ ῆς ἀρτ αβ ῶ ν ἥμισυ μέτρῳ αρτα λαχα υ χωρ ὶς διαφό ρου . καὶ τῶν περ ιγ εινομέ ν ων φοι ν ίκων κ α τὰ τὸ ἥμισυ , τῶν δημο σ ίων πάντ ω ν καὶ ἐπιβολῶν ὄντων πρὸς σὲ τὸν γεοῦχο ν , κ αὶ ἐ περωτ η θ εὶς ὡμολό γ ησ α . ὑπα τε ίας Οὐι ρί ου Νεπωτιανοῦ καὶ Τ ετ τίου Φακούνδ ου τῶν λαμπροτάτων ?",341
p.panop.7,p.panop.7,16153,"['en', 'grc']",ca. 338 - 339,0338,0339,Panopolis,"Αὐρηλίῳ ώρῳ Ἰσιδώρου ἄρξ αντι Πανὸς πόλ ε ως παρὰ Αὐρηλίου Π ασνῶτος Πασνῶτος ἀπὸ τῆς αὐτῆς . μεμίσθ ωμαι παρὰ σοῦ ἀπὸ σήμερ ον πρὸς ἐνιαυτὸν πωμάριόν σου φοινι κων φ υ νι κων περὶ τὴν αὐ τὴ ν πόλιν πεδίου Πμούχ εω ς, εἰς ὃ ἐργά σομαι πάσῃ τῇ κη πουργικῇ ἐργασίᾳ ποτίζων ἀ δ ιαλείπτως ἀ δ ιαλίπτως διὰ τῶν ἰδίων ἐμαυτ οῦ κτηνῶν, παντ ὸς τοῦ περιγεινομέν ου εν κατὰ τὸ ἥμισυ , γε ωρ γήσω δὲ τ ὴν μι",397
p.panop.29,p.panop.29,16199,"['en', 'grc']",1. - 24. Juli 332,0332-07-01,0332-07-24,Panopolis,"Αὐ ρ ηλί ῳ Σερήνῳ ἐξάκτορι Πανοπολείτου πα ρὰ Αὐ ρ ηλί ου Πασνῶτος Ἀλώπηκος ἀπὸ τῆς αὐτῆ ς Πανὸς πόλεως. πρώην ὀν ο μ α σ θ εὶς ὑπὸ Βησοῦτος ἱ ερίσσης τῆς α ὐτῆς πόλεως εἰς κτηναρχ ί αν κτηναρχε ί αν καὶ κατέφυ γον ἐπὶ τὴν ἀρε τ ὴν τοῦ κυρίου μου διασημοτάτου ἡγεμόνος Φλαυου ί ου Κυ ι ντιλλινιανοῦ περ ὶ τούτου καὶ ἔ τυχον ἀπ ο φάσεως αὐτοτελοῦ ς διʼ ὑ πομνημάτων διʼ ἧς οὑ ἐκέλευσεν τὸ μεγα λε ῖ ον αὐτο ῦ ἕτερο ν ἀ ντʼ ἐμοῦ προβληθῆναι διὰ τὴν τ οῦ γήρους μου ἡλικίαν βοηθείᾳ τοῦ ἐκδίκου οὐ κ οἶδʼ ὅπ ω ς ἀπὸ ἕκτης τοῦ ὄντος μηνὸς Ἐπεὶφ μέχρι σήμερόν σοι ὁ αὐτ ὸ ς ἐπ ὶ τῶν τόπ ων δυναστεύων κατακλείσας με εἰς τὸ δημόσιον λογιστήριον καὶ μὴ ὑπα κ ο ύ σα ς τῇ κελεύ σ ει τοῦ αὐτοῦ κυρίου μου ἡγεμόνος ἠνάγκασέν με βου λό μενός με ἐ κ τελέ σ αι τὸ φρόντισμα τῆς κτηναρχίας κτηναρχείας . συνκροτῆται οὖν τὰ δικαστήρια τοῦ αὐτοῦ κυρίου μου διασημ οτ άτ ο υ ἡγεμό νος πα ρὰ τῇ σῇ μετριότητι ἐμ οῦ τε καὶ σοῦ καὶ κατὰ τῶν προσόντων μοι δι κ αίω ν ἐξεκαλεσάμην ἀπὸ σοῦ ἐπιβοώμενος τὸ μεγαλεῖον τοῦ αὐτοῦ κυρίου μου δια σημοτάτ ου ἡγεμόν ο ς ἐπιδίδωμί σοι ταύτην τὴν ἔκκλητον ἀξιῶν δοθῆναί μοι τ ὴν συνή θ ην ὑποσημείωσιν ὑποσημίωσιν καὶ τοὺς διδομένους διδόσθαι ἀποστόλους πρὸς τὸ δύ νασθαι δι αγω νίσασθαι ἐπ ὶ τοῦ ῥητοῦ τοῦ μεγαλείο υ αὐ τ οῦ τὴν ἔκκλητον καὶ ἐκδικίας ἐκδικείας τυχεῖν καί, εἰ βο υληθείης προέσθαι μοι τὴν συνήθην ὑποσημείωσιν ὑποσημίωσιν , γινώσκειν σε ἐκ τ ῆς προθ έσεως τῶν κολλημάτων ταύτης ταυτην μου τῆς ἐκκλήτου μὴ εἴργεσθαι τὸν ἀγῶνα τόνδε μο υ τοῦ ἀχράντου δικαστηρίου αὐτοῦ ἀξιώσοντα τὸν τῆς βουλῆς σκρίβαν ποιῆσα ι τὸ πρ ο θέσιμ ο ν τῆς ἐκκλήτου. ὑ πατείας Πα π ί ο υ Πακατιανοῦ τοῦ λαμπροτάτου ἐπάρχου τοῦ ἱεροῦ πραιτωρίου καὶ Μεκιλίου Ἱλαριανοῦ τοῦ λαμπροτάτου vestiges Ἐπεὶφ",1704
p.panop.19colie,p.panop.19colie,16164e,"['en', 'grc']",,,,,"ὀνό ματος Βησᾶ Ἀντωνίνου Ἀλώπηκος ὑπὲρ γ ἰνδ ικτίωνος στιχ αρίου ἕκτον, γί νεται στιχ αρίου ϛ . ὑπατείας Λεοντίου καὶ Σαλουστίου Θώθ. Ἀντίπατ ρος ἐξ έδωκα . ι κ ἐξ έδωκα τὴν ἀποχή ν .",183
p.panop.26,p.panop.26,16196,"['en', 'grc']",28. Febr. 322,,,Panopolis,ε ἐλ ε ήσ ας τ μ μ ε τριό τ ητ τ ὰ ἀπ ο φαν θέ ντα ἐπὶ πέρας προε ες αἱ ἡμ έτ ερ αι σι αν ἐπιμετ ρ α δον ν ἵ να δυνηθῇ ἐπικρατῆσαι τ π ραγ μάτων ὅλων ἑξήκοντα ν διαγενομένων οὐκ ἐπείσθη ἐπίσθη τῷ ν ἐκβιβάζεσθαι κ ατὰ ἡγε μονικὸν ὅρον υ ν ἠπείχθην έχοντε ς ς πραχθεῖσιν τ ὸ μ έρος ἐλ αιοφοινικῶνος καὶ φρον τιστῇ π α ρα δό ντες,326
p.panop.19colvid,p.panop.19colvid,16164p,"['en', 'grc']",,,,,"ὀνό ματος υἱῶν υ ἱ ος Βησᾶ Ἀντωνίνου Ἀλώπηκος ὑπὲρ χρυσ οῦ τελωνικ οῦ ιβ ἰνδικ τίωνος γράμμα τος ἥμισυ τρίτον τετρακαιεικοστὸν ἐνενηκόσθεκτον ἐννηκοστεκτον , γίνεται γρά μματος 𐅵 γ κδ ϙϛ μόν ον . ὑπατείας Οὔρσ ου καὶ Πολεμίου Μεσορὴ ιθ . Νεμεσᾶς ἐξ έδωκα .",256
p.panop.28,p.panop.28,16198,"['en', 'grc']",9. Juli 329,,,Panopolis,"Φλαυ ί ῳ Γρη γ ο ρίῳ τῷ διασημοτάτῳ ἡγεμόνι παρὰ Αὐρηλίας Σενμώρου Σανσνῶτος διʼ ἐμοῦ Αὐρηλίου Σανσνῶτος Βησᾶ πατρὸς αὐτῆ ς τοῦ καὶ ἔχοντος αὐτὴν ὑποχειρ ίαν ἀπ ὸ Πανὸ ς πόλεως. πρὸ δωδεκαετοῦς χρόνου, οἷα γείνεται, ἡγεμὼν κύριε, ἐκ παρθενείας ἀνδρ ὶ ἐγαμήθη Πανίσκῳ τι ν ὶ ουθου ἀπὸ τῆς αὐτῆς πόλεως, ἐξ οὗ τεκνοπο ιία ν ἔσχεν, καὶ ὑπολείπεται αὐτῇ υ ἱ ός. ἔπειτα δὲ ἐξεβλήθη πρὸ ἐνιαυτοῦ, καὶ μέχρι σήμερον τρέφεται ὑπʼ ἐμοῦ μετὰ τοῦ υ ἱ οῦ αὐτῆς. οὐ μὴν ἀλλὰ καὶ ὑπέθετο ὁ ἀνὴρ αὐτῆς τὰ ἐνέχυρά μου τὰ ἐν τά ξ ει προικὸς δοθέντα αὐτῇ ὑπʼ ἐμοῦ ἐν ὥ ρᾳ γ άμου τινὶ δανειστῇ δανιστῇ , καὶ μέχρι σήμερ ον οὐκ ἀνέ λα βεν. ὕστερον δὲ με τ ὰ πολὺ ν χρόνον ἀπέσπα σεν τὸν παῖδα. διὸ πρ οήχθην δεηθῆναι τῆς σῆς χρησ τ ό τ ητος, ἡγεμὼν κ ύριε, διὰ τῆς δέ μου τῆς ἀναφο ρᾶ ς ἀξιῶν κελεῦσαι διὰ τῆς σῆς κελεύσεως διʼ οὗ ἐὰν δοκι μάσ ῃ σου τὸ μεγαλεῖον τοῦτον ἐπαναγκάσαι λυτρωθῆναι τὰ ἐνέχυρα αὐτῆς καὶ ἀποκα ταστ αθῆ ν αί μο ι καὶ μὴ ἐνοχ λεῖσθαί με περ ὶ ὀφειλῆς αὐτοῦ, ὅπως ἐκ τῆς σῆς προστάξεως τὰ ἴδια δυνάμενος ἀναλ αβ εῖν καὶ ἐ κ τούτων τραφῆναι χάριτάς σοι ὁμολογήσω. διευτύχει. ὑπατείας τῶν δεσποτῶν ἡμῶν Κωνσταντίνου Αὐ γο ύστου Ἀ γο ύστου τὸ η καὶ Κωνσταντίνου τοῦ ἐπιφανεστάτου Καίσαρος τὸ δ Ἐπεὶφ ιε . Αὐρήλιος Σ ανσνῶς ὁ προκ είμενος ἐπιδέδωκα ὡς πρόκ ειται . ἔγρα ψα ὑπὲρ α ὐτοῦ Αὐρή λιος Ἱερακίων.",1304
p.panop.14,p.panop.14,32564,"['en', 'grc']",IV,0301,0400,Panopolis,κλη ρουχικῆς τάξ εως κοί της σν βορρ ᾶ ἐχό μενα ἄρουραι κ ξδ ὧν καταπ α τήσ ει ἐλαιοφοινικ ῶνος ἄρουραι ι η φοιν ικῶνος ἄρουρα α ῥοδεῶνος ἄρουρα α η λαχ ανείας ἄρουραι ζ ξδ ψιλ ῆς ἐσπ αρμένης ἄρουραι ε 𐅵 γίνονται αἱ προκ είμεναι βορρ ᾶ ἐ χό μενα λαχ ανείας ἄρουραι δ 𐅵 δ ξδ ῥοδεῶ νος ἀρούρης 𐅵 η ὧ ν κληρο νόμων Θεωνᾶ Διδύμου καὶ κοι νωνῶν λαχ ανείας ἄρουρα α η Σερήνου καὶ Σερηνίλλας καὶ Ἀνδρονίκου τοῦ κ αὶ Σαρ α πίωνος πρ εσβυτέρου Ἀρείου καὶ Μα ξίμου λαχ ανείας ἀρούρης 𐅵 δ Θέωνος τοῦ κ αὶ Δημ ητρ ίου καὶ κοι νωνῶν λαχ ανείας κ αὶ ῥοδ εῶνος ἀρούρης 𐅵 ου τ ο ῦ κ αὶ Δ ια νοῦ καὶ Ἀρείας καὶ κ ληρο νόμων Πανίσκου τοῦ κ αὶ Διονυσίου ῥοδε ῶνος καὶ λαχ ανείας ἀρούρης δ η Δεκιανοῦ Δαικιανοῦ τοῦ κ αὶ Σαβείνου ῥοδ εῶνος καὶ λα χανείας ἀρούρης η Ὥρ ου στεφανηπλόκ ου καὶ Πετήσι ος καὶ κοι νωνῶν ῥοδε ῶνος καὶ λαχ ανείας ἀρούρης 𐅵 Πετήσιος στεφανηπλόκ ου καὶ Πβήκ ιος ἀδελφοῦ ῥοδ εῶνος καὶ λαχ ανείας ἀρούρης 𐅵 η τ ῆς κ αὶ Πλ ου τ άρχ ης ῥοδ εῶνος καὶ λαχ ανείας ἀρούρης 𐅵,969
p.panop.19colib,p.panop.19colib,16164b,"['en', 'grc']",,,,,"ὀν όματος υἱῶν Ἀντωνίνου Βησᾶ Ἀλώπεκος ὑπ ὲρ β νέας ἰνδικτ ίωνος χρυσοῦ τελωνικοῦ ἐπικεφαλαίου γ ράμματος ἥμισυ τρίτον τετρακαιεικοστὸν τεσσα ρακοστόγδοον τεσσα ρακοσόγδοον ἐνενηκόσθεκτον ἐννηκοσεκτον , γί νεται γρ άμματος 𐅵 γ κδ μη ϙϛ μόνον. ὑπατείας Φουρίου Πλακίδου Πλακίτου καὶ Φλαυ ί ου Ῥωμύλου τῶν λαμπροτάτων Θὼθ ιε . Ἱ έραξ ἐξ έδωκα .",342
p.panop.23,p.panop.23,16194,"['en', 'grc']",nach 314,0314,,Panopolis,Γε σιθέῳ τῷ καὶ Ἀπολ λ στρατ ηγ ῷ ἤτοι ἐξάκτορι Π ανοπολ είτου π αρὰ Αὐρηλ ίου ς Βησᾶ ἀπὸ τῆς α ὐτῆς . εἰ ς χρείαν με γά λη ν ἐλθόν τι Βησᾷ ἀδελφῷ μου σα κ αὶ οὐ βουλη θεὶς αὐτὸν περι ι δεῖ ν τῆς ἐμῆς συ μ βίου ὑποθέμενος τ ὰ π αρʼ αὐτοῦ τότε ζητο ύμ ε να διέλυσα καὶ πρὸ ς ἀσφ άλειαν τῶν δοθέντων ὑπὲρ αὐτοῦ ὑποθήκην ἔθετο εἰ ς ὄνομα τῆς ἐμ ῆς συμβίου Θεοδώρας μέρους ἐλαιο φ οινικῶ νος ρ α ε τον παρ εῖδ εν ἕ ως δ καὶ περ ὶ τούτων ἐν τ υχὼν τῷ διαση μοτάτῳ Ἀντω νί ῳ Γρ η γορίῳ ἔτυχον ὑπ ογ ρ αφῆς οὕτως ἐχού σης· τὰ το ῦ ἀδελφοῦ ἐνέχυρ α η ἐπιλ ύ ε σ θαι τ οῦ τον τὸ ὄφλημ α ὑπατείας Ῥουφίου Οὐολ ουσιανοῦ καὶ Π ετρωνίου Ἀννια νοῦ τῶν λ α μπρο τάτων τ ὴν σὴν ἐπιεί κειαν,673
p.panop.19colviiia,p.panop.19colviiia,16164r,"['en', 'grc']",,,,,ὀν όματος υἱῶν Ἀλώπηκος ὑπ ὲρ στεγέστρου τρεισκαι τρεισκαι ι δεκάτης ἰνδικτίωνος τὰ αἱροῦντα. ὑπατεί ας τὸ β καὶ τὸ α . Θεόδωρος Περσέως ἐξέδωκα.,145
p.panop.25,p.panop.25,32565,"['en', 'grc']",ca. 316,,,Panopolis,Αὐρηλί ω ι Αἰνείᾳ,17
p.panop.17,p.panop.17,16162,"['en', 'grc']",25. Febr. - 26. März 329,0329-02-25,0329-03-26,Panopolis,"Ἁρποκρᾶς Πασνῶτι Ἀλώ π η κος χ αίρειν . δὸς ἀπὸ λόγ ου χλαμυδαρχικοῦ Ποιμ ενίῳ ἐπείκ τῃ α πάγου β ἰνδ ικτίωνος ἀργυρίου τάλαντα δύο, γί νεται τάλαντα β μό να . ὑπατείας τὸ η καὶ τὸ δ Φαμε νώθ . Ἁρποκρ ᾶ ς ἐσημ ειωσάμην ὡ ς πρόκ ειται . Ποι μένιος ἔσχ ον τάλαντ α δ ύ ο .",270
p.panop.19colii,p.panop.19colii,16164f,"['en', 'grc']",,,,,"ὀν ομά των υἱῶ ν Βησᾶ Ἀντωνίνου Ἀντονίνου Ἀλώπεκος Ἀλωπ ε ξ ὑπὲρ τελωνικοῦ δ νέας ἰνδικ τίωνος χρυσοῦ γράμμα ἕν, γί νεται γρ άμμα α . ὑπατείας Ἀμαντίου καὶ Ἀλβίνου τῶν λαμπροτάτων Φαῶφι ιη . Παμῖνις Ἰσιδώρου ἐξ έδωκα .",218
p.panop.18,p.panop.18,16163,"['en', 'grc']",ca. 329,,,Panopolis,"Ἁρποκρᾶς Πασνῶτι Ἀλώπ η κ ος χ αίρειν . δὸς τοῖς ἀπαιτηταῖς ὀφείλεις μοι λόγου χλαμυδαρχικοῦ τάλαντα δύο δραχμὰς δισ χιλίας δισ χειλίας πεντακοσίας, γί νεται τάλαντα β Βφ Χ οιάκ. Ἁρποκρᾶς ἐσημ ειωσάμην ἐπίσταλ μα ἀργ υρίου ταλάντων β Βφ μ όνα . ἔσχον τὰ δηλωθέντ α διὰ τοῦ χειρο ἐπιστάλματος τάλαντα β δραχμὰς Βφ ὡς πρόκ ειται .",328
